{
  "contract_version": "v1",
  "event_name": "workflow.activity",
  "activity_statuses": [
    "queued",
    "running",
    "waiting",
    "completed",
    "failed",
    "cancelled",
    "skipped"
  ],
  "activity_kinds": ["phase", "node", "tool", "subgraph"],
  "scenarios": [
    {
      "id": "sequential-nodes",
      "description": "A root node completes before the next node starts.",
      "events": [
        {
          "event_id": "evt_seq_001",
          "seq_id": 1,
          "event_version": "v1",
          "event_name": "workflow.activity",
          "thread_id": "thread_activity_seq",
          "run_id": "run_activity_seq",
          "occurred_at": "2026-10-24T00:00:01Z",
          "payload": {
            "activity_id": "intent.extraction",
            "thread_id": "thread_activity_seq",
            "run_id": "run_activity_seq",
            "scope_path": ["intent", "extraction"],
            "kind": "node",
            "status": "running",
            "label": "Resolve intent",
            "attempt": 1
          }
        },
        {
          "event_id": "evt_seq_002",
          "seq_id": 2,
          "event_version": "v1",
          "event_name": "workflow.activity",
          "thread_id": "thread_activity_seq",
          "run_id": "run_activity_seq",
          "occurred_at": "2026-10-24T00:00:02Z",
          "payload": {
            "activity_id": "intent.extraction",
            "thread_id": "thread_activity_seq",
            "run_id": "run_activity_seq",
            "scope_path": ["intent", "extraction"],
            "kind": "node",
            "status": "completed",
            "label": "Resolve intent",
            "progress": 100,
            "attempt": 1
          }
        },
        {
          "event_id": "evt_seq_003",
          "seq_id": 3,
          "event_version": "v1",
          "event_name": "workflow.activity",
          "thread_id": "thread_activity_seq",
          "run_id": "run_activity_seq",
          "occurred_at": "2026-10-24T00:00:03Z",
          "payload": {
            "activity_id": "intent.searching",
            "thread_id": "thread_activity_seq",
            "run_id": "run_activity_seq",
            "scope_path": ["intent", "searching"],
            "kind": "node",
            "status": "running",
            "label": "Search ticker candidates",
            "attempt": 1
          }
        }
      ],
      "snapshot": {
        "thread_id": "thread_activity_seq",
        "run_id": "run_activity_seq",
        "run_status": "running",
        "cursor": 3,
        "active_activities": [
          {
            "activity_id": "intent.searching",
            "thread_id": "thread_activity_seq",
            "run_id": "run_activity_seq",
            "scope_path": ["intent", "searching"],
            "kind": "node",
            "status": "running",
            "label": "Search ticker candidates",
            "attempt": 1
          }
        ],
        "recent_activities": [
          {
            "activity_id": "intent.extraction",
            "thread_id": "thread_activity_seq",
            "run_id": "run_activity_seq",
            "scope_path": ["intent", "extraction"],
            "kind": "node",
            "status": "completed",
            "label": "Resolve intent",
            "progress": 100,
            "attempt": 1
          }
        ]
      },
      "assertions": {
        "active_activity_ids": ["intent.searching"],
        "completed_activity_ids": ["intent.extraction"],
        "aggregate_progress": "omitted"
      }
    },
    {
      "id": "parallel-subgraphs",
      "description": "Bull and bear subgraphs run concurrently under one parent activity.",
      "events": [
        {
          "event_id": "evt_parallel_001",
          "seq_id": 1,
          "event_version": "v1",
          "event_name": "workflow.activity",
          "thread_id": "thread_activity_parallel",
          "run_id": "run_activity_parallel",
          "occurred_at": "2026-10-24T00:01:01Z",
          "payload": {
            "activity_id": "debate",
            "thread_id": "thread_activity_parallel",
            "run_id": "run_activity_parallel",
            "scope_path": ["debate"],
            "kind": "subgraph",
            "status": "running",
            "label": "Review the thesis",
            "attempt": 1
          }
        },
        {
          "event_id": "evt_parallel_002",
          "seq_id": 2,
          "event_version": "v1",
          "event_name": "workflow.activity",
          "thread_id": "thread_activity_parallel",
          "run_id": "run_activity_parallel",
          "occurred_at": "2026-10-24T00:01:02Z",
          "payload": {
            "activity_id": "debate.bull",
            "parent_activity_id": "debate",
            "thread_id": "thread_activity_parallel",
            "run_id": "run_activity_parallel",
            "scope_path": ["debate", "bull"],
            "kind": "subgraph",
            "status": "running",
            "label": "Build the bull case",
            "attempt": 1
          }
        },
        {
          "event_id": "evt_parallel_003",
          "seq_id": 3,
          "event_version": "v1",
          "event_name": "workflow.activity",
          "thread_id": "thread_activity_parallel",
          "run_id": "run_activity_parallel",
          "occurred_at": "2026-10-24T00:01:03Z",
          "payload": {
            "activity_id": "debate.bear",
            "parent_activity_id": "debate",
            "thread_id": "thread_activity_parallel",
            "run_id": "run_activity_parallel",
            "scope_path": ["debate", "bear"],
            "kind": "subgraph",
            "status": "running",
            "label": "Build the bear case",
            "attempt": 1
          }
        },
        {
          "event_id": "evt_parallel_004",
          "seq_id": 4,
          "event_version": "v1",
          "event_name": "workflow.activity",
          "thread_id": "thread_activity_parallel",
          "run_id": "run_activity_parallel",
          "occurred_at": "2026-10-24T00:01:04Z",
          "payload": {
            "activity_id": "debate.bull",
            "parent_activity_id": "debate",
            "thread_id": "thread_activity_parallel",
            "run_id": "run_activity_parallel",
            "scope_path": ["debate", "bull"],
            "kind": "subgraph",
            "status": "completed",
            "label": "Build the bull case",
            "attempt": 1
          }
        },
        {
          "event_id": "evt_parallel_005",
          "seq_id": 5,
          "event_version": "v1",
          "event_name": "workflow.activity",
          "thread_id": "thread_activity_parallel",
          "run_id": "run_activity_parallel",
          "occurred_at": "2026-10-24T00:01:05Z",
          "payload": {
            "activity_id": "debate.bear",
            "parent_activity_id": "debate",
            "thread_id": "thread_activity_parallel",
            "run_id": "run_activity_parallel",
            "scope_path": ["debate", "bear"],
            "kind": "subgraph",
            "status": "completed",
            "label": "Build the bear case",
            "attempt": 1
          }
        }
      ],
      "snapshot": {
        "thread_id": "thread_activity_parallel",
        "run_id": "run_activity_parallel",
        "run_status": "running",
        "cursor": 5,
        "active_activities": [
          {
            "activity_id": "debate",
            "thread_id": "thread_activity_parallel",
            "run_id": "run_activity_parallel",
            "scope_path": ["debate"],
            "kind": "subgraph",
            "status": "running",
            "label": "Review the thesis",
            "attempt": 1
          }
        ],
        "recent_activities": [
          {
            "activity_id": "debate.bull",
            "parent_activity_id": "debate",
            "thread_id": "thread_activity_parallel",
            "run_id": "run_activity_parallel",
            "scope_path": ["debate", "bull"],
            "kind": "subgraph",
            "status": "completed",
            "label": "Build the bull case",
            "attempt": 1
          },
          {
            "activity_id": "debate.bear",
            "parent_activity_id": "debate",
            "thread_id": "thread_activity_parallel",
            "run_id": "run_activity_parallel",
            "scope_path": ["debate", "bear"],
            "kind": "subgraph",
            "status": "completed",
            "label": "Build the bear case",
            "attempt": 1
          }
        ]
      },
      "assertions": {
        "active_activity_ids": ["debate"],
        "parallel_child_activity_ids": ["debate.bull", "debate.bear"],
        "aggregate_progress": "forbidden"
      }
    },
    {
      "id": "repeated-invocation",
      "description": "The same logical node is invoked twice in one run.",
      "events": [
        {
          "event_id": "evt_repeat_001",
          "seq_id": 1,
          "event_version": "v1",
          "event_name": "workflow.activity",
          "thread_id": "thread_activity_repeat",
          "run_id": "run_activity_repeat",
          "occurred_at": "2026-10-24T00:02:01Z",
          "payload": {
            "activity_id": "news.fetch",
            "thread_id": "thread_activity_repeat",
            "run_id": "run_activity_repeat",
            "scope_path": ["news", "fetch"],
            "kind": "node",
            "status": "running",
            "label": "Fetch selected articles",
            "attempt": 1
          }
        },
        {
          "event_id": "evt_repeat_002",
          "seq_id": 2,
          "event_version": "v1",
          "event_name": "workflow.activity",
          "thread_id": "thread_activity_repeat",
          "run_id": "run_activity_repeat",
          "occurred_at": "2026-10-24T00:02:02Z",
          "payload": {
            "activity_id": "news.fetch",
            "thread_id": "thread_activity_repeat",